{
  "$schema": "https://raw.githubusercontent.com/anupmaster/scalpel/main/schemas/config.schema.json",
  "version": "2.0",
  "scan": {
    "dimensions": {
      "include": ["all"],
      "exclude": [],
      "custom": [
        {
          "name": "django-security-settings",
          "description": "Check settings.py for production-ready security: DEBUG=False, ALLOWED_HOSTS, SECURE_SSL_REDIRECT, CSRF_COOKIE_SECURE, SESSION_COOKIE_SECURE",
          "command": "grep -rn 'DEBUG\\s*=\\s*False\\|ALLOWED_HOSTS\\s*=\\s*\\[.\\+\\]\\|SECURE_SSL_REDIRECT\\s*=\\s*True\\|CSRF_COOKIE_SECURE\\s*=\\s*True\\|SESSION_COOKIE_SECURE\\s*=\\s*True' **/settings*.py | wc -l | awk '{exit ($1 < 3)}'",
          "scoring": { "pass": 5, "fail": 0 }
        },
        {
          "name": "django-admin-coverage",
          "description": "Count models vs admin.site.register calls to verify all models are registered in the Django admin",
          "command": "models=$(grep -rc 'class.*Model)' --include='*models*.py' . | awk -F: '{s+=$2} END {print s+0}'); admins=$(grep -rc 'admin.site.register\\|@admin.register' --include='*admin*.py' . | awk -F: '{s+=$2} END {print s+0}'); echo \"Models: $models, Admin registrations: $admins\"; test $admins -ge $models",
          "scoring": { "pass": 5, "fail": 0 }
        },
        {
          "name": "django-migration-health",
          "description": "Check for migration files and ensure no conflicting migrations exist in any app",
          "command": "migrations=$(find . -path '*/migrations/0*.py' | wc -l); echo \"$migrations migration files found\"; test $migrations -gt 0",
          "scoring": { "pass": 5, "fail": 0 }
        }
      ]
    },
    "ignore_paths": [
      "__pycache__/",
      "*.pyc",
      "venv/",
      ".venv/",
      "staticfiles/",
      "media/"
    ],
    "secret_patterns": [
      "DJANGO_SECRET_KEY",
      "DATABASE_URL"
    ]
  },
  "team": {
    "max_agents": 4,
    "default_model": "sonnet",
    "architect_model": "opus",
    "custom_roles": [
      {
        "name": "django-specialist",
        "trigger": "test -f manage.py || grep -q 'django' requirements.txt 2>/dev/null || grep -q 'django' Pipfile 2>/dev/null || grep -q 'django' pyproject.toml 2>/dev/null",
        "jurisdiction": [
          "src/**/models.py",
          "src/**/views.py",
          "src/**/urls.py"
        ],
        "prompt": "You are a Django specialist. Audit the project for Django best practices and patterns: proper model design (indexes, constraints, verbose names), class-based views vs function-based views used appropriately, URL namespacing, correct use of querysets (select_related/prefetch_related to avoid N+1 queries), proper middleware ordering, secure settings configuration, form validation, template security (autoescape enabled), signal usage, and migration hygiene. Flag any anti-patterns such as raw SQL without parameterization, Fat views instead of Fat models, missing CSRF protection, or unindexed foreign keys."
      }
    ]
  },
  "scoring": {
    "custom_rules": [
      {
        "name": "no-debug-true",
        "check": "! grep -rn 'DEBUG\\s*=\\s*True' --include='*settings*.py' . | grep -v 'local_settings\\|settings_local\\|settings.dev\\|settings_dev\\|settings.local' | grep -q '.'",
        "deduction": -5,
        "bonus": 0,
        "message": "DEBUG = True found in non-local settings files — ensure DEBUG is False in production configurations."
      },
      {
        "name": "admin-registered",
        "check": "models=$(grep -rc 'class.*Model)' --include='*models*.py' . 2>/dev/null | awk -F: '{s+=$2} END {print s+0}'); admins=$(grep -rc 'admin.site.register\\|@admin.register' --include='*admin*.py' . 2>/dev/null | awk -F: '{s+=$2} END {print s+0}'); test $admins -ge $models",
        "deduction": 0,
        "bonus": 3,
        "message": "All models are registered in the Django admin — good admin coverage."
      },
      {
        "name": "password-validators",
        "check": "grep -rq 'AUTH_PASSWORD_VALIDATORS' --include='*settings*.py' .",
        "deduction": 0,
        "bonus": 2,
        "message": "AUTH_PASSWORD_VALIDATORS configured — password policy enforcement is in place."
      }
    ],
    "thresholds": {
      "excellent": 90,
      "good": 75,
      "needs_improvement": 60,
      "at_risk": 40
    }
  },
  "monitoring": {
    "interval_minutes": 30,
    "alert_threshold": 5,
    "auto_start": false
  },
  "memory": {
    "enabled": true,
    "path": ".scalpel/memory.jsonl"
  }
}
